{
  "_note": "Fictional sample data for the ql-charts demo. Not real market data.",
  "symbol": "ACME",
  "price": 217.91,
  "prices": [
    [
      "2025-12-05",
      159.39
    ],
    [
      "2026-01-05",
      153.73
    ],
    [
      "2026-02-03",
      169.24
    ],
    [
      "2026-03-04",
      170.87
    ],
    [
      "2026-04-02",
      170.13
    ],
    [
      "2026-05-01",
      169.3
    ],
    [
      "2026-06-01",
      185.69
    ],
    [
      "2026-06-30",
      203.56
    ],
    [
      "2026-07-29",
      194.36
    ],
    [
      "2026-08-27",
      214.69
    ],
    [
      "2026-09-25",
      229.47
    ],
    [
      "2026-10-26",
      215.74
    ],
    [
      "2026-10-27",
      217.91
    ]
  ],
  "low": 165.61,
  "average": 355.19,
  "median": 339.94,
  "high": 603.61,
  "horizonMonths": 12
}
